{
  "$schema": "https://json-schema.org/draft/2020-12/schema",
  "title": "PkgSafe real repository benchmark list",
  "type": "array",
  "items": {
    "type": "object",
    "required": ["name", "path", "ecosystems", "repo_type"],
    "additionalProperties": false,
    "properties": {
      "name": { "type": "string", "minLength": 1 },
      "path": { "type": "string", "minLength": 1 },
      "ecosystems": {
        "type": "array",
        "items": { "type": "string", "enum": ["npm", "pypi", "go", "cargo"] },
        "minItems": 1,
        "uniqueItems": true
      },
      "repo_type": {
        "type": "string",
        "enum": [
          "npm-simple-app",
          "small-npm-app",
          "react-vite-app",
          "react-vite-next-app",
          "nextjs-app",
          "npm-workspace-monorepo",
          "node-backend-api",
          "python-requirements-app",
          "python-poetry-app",
          "go-module-app",
          "cargo-rust-app",
          "mixed-js-python-repo",
          "internal-private-package-repo"
        ]
      },
      "expected_package_manager": {
        "type": "string",
        "enum": ["npm", "pnpm", "yarn", "pip", "poetry", "go", "cargo"]
      },
      "expected_min_direct_dependencies": { "type": "integer", "minimum": 0 },
      "expected_min_transitive_dependencies": { "type": "integer", "minimum": 0 },
      "expected_output_artifacts": {
        "type": "array",
        "items": { "type": "string", "enum": ["json", "sarif", "markdown_summary", "evidence_pack"] },
        "uniqueItems": true
      },
      "expected_no_false_block": { "type": "boolean" },
      "expected_max_false_warn_rate": {
        "type": "number",
        "minimum": 0,
        "maximum": 1,
        "description": "Ratio between 0 and 1. Example: 0.10 means 10%."
      },
      "behavior_mode": { "type": "string", "enum": ["disabled", "heuristic", "isolated"] },
      "offline": { "type": "boolean" },
      "notes": { "type": "string" },
      "private_beta_required": { "type": "boolean" },
      "ga_required": { "type": "boolean" }
    }
  }
}
