[
  {
    "name": "small-npm-app",
    "path": "testdata/benchmarks/small-npm-app",
    "ecosystems": ["npm"],
    "repo_type": "small-npm-app",
    "expected_package_manager": "npm",
    "expected_min_direct_dependencies": 1,
    "expected_min_transitive_dependencies": 0,
    "expected_output_artifacts": ["json", "sarif", "markdown_summary", "evidence_pack"],
    "expected_no_false_block": true,
    "expected_max_false_warn_rate": 0.10,
    "behavior_mode": "disabled",
    "offline": true,
    "private_beta_required": true,
    "ga_required": true
  },
  {
    "name": "react-vite-next-app",
    "path": "testdata/benchmarks/react-vite-app",
    "ecosystems": ["npm"],
    "repo_type": "react-vite-app",
    "expected_package_manager": "npm",
    "expected_min_direct_dependencies": 4,
    "expected_min_transitive_dependencies": 0,
    "expected_output_artifacts": ["json", "sarif", "markdown_summary", "evidence_pack"],
    "expected_no_false_block": true,
    "expected_max_false_warn_rate": 0.10,
    "behavior_mode": "disabled",
    "offline": true,
    "private_beta_required": true,
    "ga_required": true
  },
  {
    "name": "npm-monorepo",
    "path": "testdata/benchmarks/npm-workspace-monorepo",
    "ecosystems": ["npm"],
    "repo_type": "npm-workspace-monorepo",
    "expected_package_manager": "npm",
    "expected_min_direct_dependencies": 3,
    "expected_min_transitive_dependencies": 0,
    "expected_output_artifacts": ["json", "sarif", "markdown_summary", "evidence_pack"],
    "expected_no_false_block": true,
    "expected_max_false_warn_rate": 0.15,
    "behavior_mode": "disabled",
    "offline": true,
    "private_beta_required": true,
    "ga_required": true
  },
  {
    "name": "node-backend-api",
    "path": "testdata/benchmarks/node-backend-api",
    "ecosystems": ["npm"],
    "repo_type": "node-backend-api",
    "expected_package_manager": "npm",
    "expected_min_direct_dependencies": 3,
    "expected_min_transitive_dependencies": 1,
    "expected_output_artifacts": ["json", "sarif", "markdown_summary", "evidence_pack"],
    "expected_no_false_block": true,
    "expected_max_false_warn_rate": 0.10,
    "behavior_mode": "disabled",
    "offline": true,
    "private_beta_required": true,
    "ga_required": true
  },
  {
    "name": "python-requirements-app",
    "path": "testdata/benchmarks/python-app",
    "ecosystems": ["pypi"],
    "repo_type": "python-requirements-app",
    "expected_package_manager": "pip",
    "expected_min_direct_dependencies": 3,
    "expected_min_transitive_dependencies": 0,
    "expected_output_artifacts": ["json", "markdown_summary", "evidence_pack"],
    "expected_no_false_block": true,
    "expected_max_false_warn_rate": 0.10,
    "behavior_mode": "disabled",
    "offline": true,
    "private_beta_required": true,
    "ga_required": true
  },
  {
    "name": "larger-frontend-nextjs-app",
    "path": "testdata/benchmarks/nextjs-app",
    "ecosystems": ["npm"],
    "repo_type": "nextjs-app",
    "expected_package_manager": "npm",
    "expected_min_direct_dependencies": 4,
    "expected_min_transitive_dependencies": 0,
    "expected_output_artifacts": ["json", "sarif", "markdown_summary", "evidence_pack"],
    "expected_no_false_block": true,
    "expected_max_false_warn_rate": 0.10,
    "behavior_mode": "disabled",
    "offline": true,
    "private_beta_required": true,
    "ga_required": true
  },
  {
    "name": "mixed-js-python-preview",
    "path": "testdata/benchmarks/mixed-js-python-repo",
    "ecosystems": ["npm", "pypi"],
    "repo_type": "mixed-js-python-repo",
    "expected_package_manager": "npm",
    "expected_min_direct_dependencies": 3,
    "expected_min_transitive_dependencies": 0,
    "expected_output_artifacts": ["json", "sarif", "markdown_summary", "evidence_pack"],
    "expected_no_false_block": true,
    "expected_max_false_warn_rate": 0.10,
    "behavior_mode": "disabled",
    "offline": true,
    "private_beta_required": true,
    "ga_required": true
  },
  {
    "name": "npm-workspace-tools",
    "path": "testdata/benchmarks/npm-workspace-tools",
    "ecosystems": ["npm"],
    "repo_type": "npm-workspace-monorepo",
    "expected_package_manager": "npm",
    "expected_min_direct_dependencies": 4,
    "expected_min_transitive_dependencies": 0,
    "expected_output_artifacts": ["json", "sarif", "markdown_summary", "evidence_pack"],
    "expected_no_false_block": true,
    "expected_max_false_warn_rate": 0.10,
    "behavior_mode": "disabled",
    "offline": true,
    "private_beta_required": false,
    "ga_required": true
  },
  {
    "name": "npm-workspace-admin",
    "path": "testdata/benchmarks/npm-workspace-admin",
    "ecosystems": ["npm"],
    "repo_type": "npm-workspace-monorepo",
    "expected_package_manager": "npm",
    "expected_min_direct_dependencies": 5,
    "expected_min_transitive_dependencies": 0,
    "expected_output_artifacts": ["json", "sarif", "markdown_summary", "evidence_pack"],
    "expected_no_false_block": true,
    "expected_max_false_warn_rate": 0.10,
    "behavior_mode": "disabled",
    "offline": true,
    "private_beta_required": false,
    "ga_required": true
  },
  {
    "name": "node-backend-worker",
    "path": "testdata/benchmarks/node-backend-worker",
    "ecosystems": ["npm"],
    "repo_type": "node-backend-api",
    "expected_package_manager": "npm",
    "expected_min_direct_dependencies": 4,
    "expected_min_transitive_dependencies": 0,
    "expected_output_artifacts": ["json", "sarif", "markdown_summary", "evidence_pack"],
    "expected_no_false_block": true,
    "expected_max_false_warn_rate": 0.10,
    "behavior_mode": "disabled",
    "offline": true,
    "private_beta_required": false,
    "ga_required": true
  },
  {
    "name": "node-backend-graphql",
    "path": "testdata/benchmarks/node-backend-graphql",
    "ecosystems": ["npm"],
    "repo_type": "node-backend-api",
    "expected_package_manager": "npm",
    "expected_min_direct_dependencies": 4,
    "expected_min_transitive_dependencies": 0,
    "expected_output_artifacts": ["json", "sarif", "markdown_summary", "evidence_pack"],
    "expected_no_false_block": true,
    "expected_max_false_warn_rate": 0.10,
    "behavior_mode": "disabled",
    "offline": true,
    "private_beta_required": false,
    "ga_required": true
  },
  {
    "name": "dashboard-vite-app",
    "path": "testdata/benchmarks/dashboard-vite-app",
    "ecosystems": ["npm"],
    "repo_type": "react-vite-app",
    "expected_package_manager": "npm",
    "expected_min_direct_dependencies": 4,
    "expected_min_transitive_dependencies": 0,
    "expected_output_artifacts": ["json", "sarif", "markdown_summary", "evidence_pack"],
    "expected_no_false_block": true,
    "expected_max_false_warn_rate": 0.10,
    "behavior_mode": "disabled",
    "offline": true,
    "private_beta_required": false,
    "ga_required": true
  },
  {
    "name": "python-poetry-service",
    "path": "testdata/benchmarks/python-poetry-service",
    "ecosystems": ["pypi"],
    "repo_type": "python-poetry-app",
    "expected_package_manager": "poetry",
    "expected_min_direct_dependencies": 3,
    "expected_min_transitive_dependencies": 0,
    "expected_output_artifacts": ["json", "markdown_summary", "evidence_pack"],
    "expected_no_false_block": true,
    "expected_max_false_warn_rate": 0.10,
    "behavior_mode": "disabled",
    "offline": true,
    "private_beta_required": false,
    "ga_required": true
  },
  {
    "name": "python-cli-app",
    "path": "testdata/benchmarks/python-cli-app",
    "ecosystems": ["pypi"],
    "repo_type": "python-requirements-app",
    "expected_package_manager": "pip",
    "expected_min_direct_dependencies": 3,
    "expected_min_transitive_dependencies": 0,
    "expected_output_artifacts": ["json", "markdown_summary", "evidence_pack"],
    "expected_no_false_block": true,
    "expected_max_false_warn_rate": 0.10,
    "behavior_mode": "disabled",
    "offline": true,
    "private_beta_required": false,
    "ga_required": true
  },
  {
    "name": "internal-private-package-repo",
    "path": "testdata/benchmarks/internal-private-package-repo",
    "ecosystems": ["npm"],
    "repo_type": "internal-private-package-repo",
    "expected_package_manager": "npm",
    "expected_min_direct_dependencies": 3,
    "expected_min_transitive_dependencies": 0,
    "expected_output_artifacts": ["json", "sarif", "markdown_summary", "evidence_pack"],
    "expected_no_false_block": true,
    "expected_max_false_warn_rate": 0.10,
    "behavior_mode": "disabled",
    "offline": true,
    "notes": "Synthetic private-registry style fixture with scoped internal packages.",
    "private_beta_required": false,
    "ga_required": true
  }
]
